{
  "datasource_id": "sample-market-note-001",
  "source_name": "Tokyo Frozen Food Market Notes",
  "source_type": "market_notes",
  "license_type": "internal",
  "allowed_use": [
    "research",
    "prototype"
  ],
  "retrieved_at": "2026-06-22T10:00:00Z",
  "coverage_region": [
    "tokyo-metropolitan"
  ],
  "quality_score": 0.7,
  "provenance": {
    "collected_by": "project-team",
    "collected_method": "manual_import",
    "notes": "sample data for MVP"
  }
}